{
  "schema_version": "0.1",
  "name": "illustrative Zn4O-BDC pcu design",
  "identifiers": {
    "common_name": "MOF-5-like",
    "mofid": "[O-]C(=O)c1ccc(cc1)C(=O)[O-].[Zn][O]([Zn])([Zn])[Zn] MOFid-v1.pcu.cat0"
  },
  "building_blocks": [
    {
      "id": "zn4o_node",
      "role": "node",
      "atom_graph": {
        "atoms": [
          {"id": "Zn1", "element": "Zn"},
          {"id": "Zn2", "element": "Zn"},
          {"id": "Zn3", "element": "Zn"},
          {"id": "Zn4", "element": "Zn"},
          {"id": "O1", "element": "O"}
        ],
        "bonds": [
          {"atoms": ["O1", "Zn1"], "order": "coordination"},
          {"atoms": ["O1", "Zn2"], "order": "coordination"},
          {"atoms": ["O1", "Zn3"], "order": "coordination"},
          {"atoms": ["O1", "Zn4"], "order": "coordination"}
        ]
      },
      "connection_sites": [
        {"id": "nx", "anchor_atoms": ["Zn1", "Zn2"]},
        {"id": "ny", "anchor_atoms": ["Zn1", "Zn3"]},
        {"id": "nz", "anchor_atoms": ["Zn1", "Zn4"]},
        {"id": "px", "anchor_atoms": ["Zn3", "Zn4"]},
        {"id": "py", "anchor_atoms": ["Zn2", "Zn4"]},
        {"id": "pz", "anchor_atoms": ["Zn2", "Zn3"]}
      ]
    },
    {
      "id": "bdc_linker",
      "role": "linker",
      "atom_graph": {
        "atoms": [
          {"id": "C1", "element": "C"},
          {"id": "C2", "element": "C"},
          {"id": "C3", "element": "C"},
          {"id": "C4", "element": "C"},
          {"id": "C5", "element": "C"},
          {"id": "C6", "element": "C"},
          {"id": "C7", "element": "C"},
          {"id": "C8", "element": "C"},
          {"id": "O1", "element": "O", "formal_charge": -1},
          {"id": "O2", "element": "O"},
          {"id": "O3", "element": "O", "formal_charge": -1},
          {"id": "O4", "element": "O"}
        ],
        "bonds": [
          {"atoms": ["C1", "C2"], "order": 1.5},
          {"atoms": ["C2", "C3"], "order": 1.5},
          {"atoms": ["C3", "C4"], "order": 1.5},
          {"atoms": ["C4", "C5"], "order": 1.5},
          {"atoms": ["C5", "C6"], "order": 1.5},
          {"atoms": ["C6", "C1"], "order": 1.5},
          {"atoms": ["C1", "C7"], "order": 1},
          {"atoms": ["C7", "O1"], "order": 1},
          {"atoms": ["C7", "O2"], "order": 2},
          {"atoms": ["C4", "C8"], "order": 1},
          {"atoms": ["C8", "O3"], "order": 1},
          {"atoms": ["C8", "O4"], "order": 2}
        ]
      },
      "connection_sites": [
        {"id": "a", "anchor_atoms": ["O1", "O2"]},
        {"id": "b", "anchor_atoms": ["O3", "O4"]}
      ]
    }
  ],
  "net": {
    "name": "pcu",
    "dimension": 3,
    "catenation": 0,
    "vertices": [
      {"id": "node_0", "building_block": "zn4o_node"},
      {"id": "linker_x", "building_block": "bdc_linker"},
      {"id": "linker_y", "building_block": "bdc_linker"},
      {"id": "linker_z", "building_block": "bdc_linker"}
    ],
    "edges": [
      {
        "id": "e1",
        "source": {"vertex": "node_0", "connection_site": "px", "image": [0, 0, 0]},
        "target": {"vertex": "linker_x", "connection_site": "a", "image": [0, 0, 0]}
      },
      {
        "id": "e2",
        "source": {"vertex": "linker_x", "connection_site": "b", "image": [0, 0, 0]},
        "target": {"vertex": "node_0", "connection_site": "nx", "image": [1, 0, 0]}
      },
      {
        "id": "e3",
        "source": {"vertex": "node_0", "connection_site": "py", "image": [0, 0, 0]},
        "target": {"vertex": "linker_y", "connection_site": "a", "image": [0, 0, 0]}
      },
      {
        "id": "e4",
        "source": {"vertex": "linker_y", "connection_site": "b", "image": [0, 0, 0]},
        "target": {"vertex": "node_0", "connection_site": "ny", "image": [0, 1, 0]}
      },
      {
        "id": "e5",
        "source": {"vertex": "node_0", "connection_site": "pz", "image": [0, 0, 0]},
        "target": {"vertex": "linker_z", "connection_site": "a", "image": [0, 0, 0]}
      },
      {
        "id": "e6",
        "source": {"vertex": "linker_z", "connection_site": "b", "image": [0, 0, 0]},
        "target": {"vertex": "node_0", "connection_site": "nz", "image": [0, 0, 1]}
      }
    ]
  },
  "provenance": {
    "status": "illustrative draft; not an experimental crystal structure"
  }
}
